{
  "name": "RoughInHub Publisher Guide",
  "description": "Everything you need to start publishing and earning on RoughInHub — listing creation, payout setup, pricing, and optimization.",
  "longDescription": "A comprehensive skill that guides developers through the full publisher journey on RoughInHub. Covers creating your first listing, setting up Stripe Connect for automatic payouts, hosting your source code, and optimizing your listing for discovery. Whether you're publishing a free skill or monetizing an MCP server, this guide walks you through every step.",
  "type": "skill",
  "category": "productivity",
  "sourceUrl": "https://github.com/SkillShope/SkillShope/tree/main/skills/skillshope-publisher",
  "sourceType": "github",
  "installCmd": "npx skillshope install skill-shope-publisher-guide",
  "compatibility": "claude-code,codex,cursor",
  "tags": "publishing,onboarding,getting-started",
  "isFree": true,
  "skillContent": "---\nname: skillshope-publisher\ndescription: >-\n  Guides developers through publishing and monetizing AI skills, MCP servers,\n  and agent configurations on RoughInHub. Covers listing creation, pricing\n  strategy, Stripe Connect setup for payouts, source hosting, and optimization\n  for discovery. Use when a developer wants to publish, list, sell, or monetize\n  their AI tools on RoughInHub.\n---\n\nRoughInHub is the registry for AI skills, MCP servers, and agent configurations. Publishers list their tools, set prices, and earn 85% of each sale. RoughInHub handles discovery, reviews, and payments.\n\n## Quick Start\n\n| Step | What to do | Details |\n|------|-----------|--------|\n| 1. Sign up | Sign in with GitHub at roughinhub.com | Free, takes 30 seconds |\n| 2. Set up payouts | Connect Stripe on your dashboard | Required for paid listings |\n| 3. Host your source | Push your skill to GitHub or npm | Public repo or npm package |\n| 4. Create listing | Fill out the publish form | Or upload a listing.json |\n| 5. Optimize | Improve discoverability | Tags, description, compatibility |\n\n## What Can You Publish?\n\n| Type | What it is | Example install command |\n|------|-----------|----------------------|\n| **Skill** | A SKILL.md config that teaches AI assistants a specific task | `npx skillshope install your-skill` |\n| **MCP Server** | A Model Context Protocol server for external tool access | `npx skillshope install your-mcp` |\n| **Agent** | An autonomous workflow combining skills and tools | `npx skillshope install your-agent` |\n\n## Pricing\n\n| Model | When to use | Platform fee |\n|-------|-----------|-------------|\n| **Free** | Open source tools, community building, getting initial reviews | None |\n| **Paid ($0.99+)** | Premium tools, commercial use, ongoing maintenance | 15% per sale |\n\nPublishers receive 85% of each sale automatically via Stripe Connect.\n\n## Key Policies\n\n- You retain full ownership of your code\n- No malware, spam, or IP-infringing content\n- Reviews must be genuine — you cannot review your own skills\n- Publisher verification (blue badge) is available and increases buyer trust"
}
