{
  "name": "MCP Forge",
  "description": "Generate production-ready MCP servers from OpenAPI specs, Swagger docs, or API documentation in minutes.",
  "longDescription": "Point MCP Forge at any API — OpenAPI spec, Swagger doc, or documentation URL — and get a complete, typed MCP server with tools, auth handling, error mapping, and configuration. Supports API key, OAuth, and basic auth patterns. Generates TypeScript with minimal dependencies for security. Ship MCP servers in minutes, not hours.",
  "type": "skill",
  "category": "api",
  "sourceUrl": "https://github.com/arpethel/SkillShope/blob/main/skills/mcp-forge/README.md",
  "sourceType": "github",
  "installCmd": "npx skillshope install mcp-forge",
  "compatibility": "claude-code,codex,cursor",
  "tags": "mcp,openapi,swagger,api,code-generation",
  "isFree": false,
  "price": 9.99,
  "skillContent": "---\nname: mcp-forge\ndescription: >-\n  Generates production-ready MCP (Model Context Protocol) servers from API\n  specifications. Accepts OpenAPI/Swagger specs, REST API documentation URLs,\n  or manual API descriptions and outputs a complete, typed MCP server with\n  tools, auth handling, error mapping, and configuration. Use when building\n  an MCP server from an existing API, converting an API to MCP, or scaffolding\n  a new MCP server project.\n---\n\nMCP Forge generates production-ready MCP servers from API specs. It handles the boilerplate so you ship MCP servers in minutes, not hours.\n\n## Workflow\n\n| Step | Input | Output | Reference |\n|------|-------|--------|----------|\n| 1. Provide spec | OpenAPI URL, Swagger JSON, or API docs URL | Parsed API schema | <references/input-formats.md> |\n| 2. Configure | Auth type, base URL, tool selection | Server config | <references/configuration.md> |\n| 3. Generate | Run generation command | Complete MCP server project | <references/output-structure.md> |\n| 4. Test & publish | Validate tools, publish to npm or GitHub | Live MCP server | <references/publishing.md> |\n\n## Supported Input Formats\n\n| Format | Example | Auto-detected |\n|--------|---------|---------------|\n| **OpenAPI 3.x** | `https://api.example.com/openapi.json` | Yes |\n| **Swagger 2.0** | `https://api.example.com/swagger.json` | Yes |\n| **API docs URL** | `https://docs.example.com/api` | Parsed via AI |\n| **Manual description** | \"CRUD API for users with JWT auth at api.example.com\" | Structured via AI |\n\n## Auth Patterns\n\n| Pattern | When to use | Generated code |\n|---------|-----------|----------------|\n| **API Key (header)** | Most SaaS APIs | `Authorization: Bearer ${key}` header injection |\n| **API Key (query)** | Legacy APIs | Query param injection |\n| **OAuth 2.0** | Google, GitHub, etc. | Token refresh flow with credential storage |\n| **Basic Auth** | Internal/simple APIs | Base64 encoded header |\n| **No Auth** | Public APIs | Direct requests |\n\n## Generated MCP Tools\n\nEach API endpoint becomes an MCP tool with:\n- **Typed parameters** derived from the spec (required/optional, types, descriptions)\n- **Structured responses** with consistent error handling\n- **Input validation** before making the API call\n- **Rate limiting awareness** via retry headers\n\n## Output\n\n| File | Purpose |\n|------|---------|\n| `src/index.ts` | MCP server entry point with tool registration |\n| `src/tools/*.ts` | One file per API resource group (users, orders, etc.) |\n| `src/auth.ts` | Auth provider based on configured pattern |\n| `src/types.ts` | TypeScript types generated from API schema |\n| `src/config.ts` | Server configuration (base URL, auth, rate limits) |\n| `package.json` | Dependencies, scripts, MCP server metadata |\n| `README.md` | Auto-generated docs with install command and tool list |\n| `tsconfig.json` | TypeScript configuration |\n\n## Example\n\nGiven the Stripe API OpenAPI spec:\n\n```\nInput:  https://raw.githubusercontent.com/stripe/openapi/master/openapi/spec3.json\nAuth:   API Key (header)\nSelect: customers, charges, payment_intents\n```\n\nGenerates an MCP server with tools like:\n- `list_customers` — List all customers with pagination\n- `create_customer` — Create a customer with email, name, metadata\n- `retrieve_charge` — Get charge details by ID\n- `create_payment_intent` — Create a payment intent with amount, currency\n\nEach tool has fully typed params, error handling, and Stripe-specific pagination support.\n\n## Limitations\n\n- OAuth 2.0 flows require manual credential setup after generation\n- WebSocket/streaming APIs are not yet supported\n- GraphQL APIs require the OpenAPI wrapper (not native GraphQL introspection)\n- Generated servers target Node.js/TypeScript — no Python or Go output yet"
}
